{
  "schema_version": "runsteward.provider-evidence/v1",
  "adapter_id": "runsteward.sensor.claude-limits",
  "observed_at": "2026-07-15T12:00:00Z",
  "source_status": "estimated",
  "reason_code": "claude-limit-sample-consumed",
  "metrics": [
    {
      "metric": "runsteward.claude.five-hour-used-percent",
      "value": "86",
      "unit": "account-percent",
      "source_adapter": "runsteward.sensor.claude-limits",
      "confidence": "estimated",
      "raw_evidence_ref": {
        "ref": "evidence/raw/claude-limit-state.redacted.json",
        "digest": "sha256:aaaaaaaaaaaaaaaaaaaaaaaaaaaaaaaaaaaaaaaaaaaaaaaaaaaaaaaaaaaaaaaa",
        "media_type": "application/json"
      }
    }
  ],
  "raw_evidence_refs": [
    {
      "ref": "evidence/raw/claude-limit-state.redacted.json",
      "digest": "sha256:aaaaaaaaaaaaaaaaaaaaaaaaaaaaaaaaaaaaaaaaaaaaaaaaaaaaaaaaaaaaaaaa",
      "media_type": "application/json"
    }
  ],
  "evidence_digest": "sha256:e73315790eeaf58a5fb6e5f07e8acbfe0832b9493f7ba1d84d95502e62ad1a26"
}
