{
  "schema_version": "runsteward.provider-evidence/v1",
  "adapter_id": "runsteward.sensor.codex-usage",
  "observed_at": "2026-07-15T12:00:00Z",
  "source_status": "verified",
  "reason_code": "codex-nightwatch-analysis-consumed",
  "metrics": [
    {
      "metric": "runsteward.codex.billable-like-tokens",
      "value": "1600",
      "unit": "tokens",
      "source_adapter": "runsteward.sensor.codex-usage",
      "confidence": "verified",
      "raw_evidence_ref": {
        "ref": "evidence/raw/codex-events.redacted.jsonl",
        "digest": "sha256:bbbbbbbbbbbbbbbbbbbbbbbbbbbbbbbbbbbbbbbbbbbbbbbbbbbbbbbbbbbbbbbb",
        "media_type": "application/x-ndjson"
      }
    }
  ],
  "raw_evidence_refs": [
    {
      "ref": "evidence/raw/codex-events.redacted.jsonl",
      "digest": "sha256:bbbbbbbbbbbbbbbbbbbbbbbbbbbbbbbbbbbbbbbbbbbbbbbbbbbbbbbbbbbbbbbb",
      "media_type": "application/x-ndjson"
    }
  ],
  "evidence_digest": "sha256:1fda1029e4c18e76f7ba652e5ae49a10fbe51488a342126976ce38876e3c9a05"
}
